{
  "schema_version": "1.0.0",
  "case_id": "ames-housing",
  "status": "PLANNED",
  "feature_types": [
    {
      "type_id": "nominal",
      "label": "名目"
    },
    {
      "type_id": "ordinal",
      "label": "次序"
    },
    {
      "type_id": "discrete",
      "label": "離散"
    },
    {
      "type_id": "continuous",
      "label": "連續"
    }
  ],
  "stages": [
    {
      "id": "raw",
      "label": "原始候選欄位",
      "unit": "raw_columns",
      "total": 79,
      "total_status": "SOURCE_REPORTED_NOT_VERIFIED",
      "segments": [],
      "distribution_status": "UNAVAILABLE"
    },
    {
      "id": "filtered",
      "label": "欄位排除後",
      "unit": "raw_columns",
      "total": null,
      "total_status": "UNAVAILABLE",
      "segments": [],
      "distribution_status": "UNAVAILABLE"
    },
    {
      "id": "processed",
      "label": "資料處理後",
      "unit": "pre_encoding_columns",
      "total": null,
      "total_status": "UNAVAILABLE",
      "segments": [],
      "distribution_status": "UNAVAILABLE"
    },
    {
      "id": "encoded",
      "label": "編碼後",
      "unit": "encoded_features",
      "total": 248,
      "total_status": "SOURCE_REPORTED_NOT_VERIFIED",
      "fit_population": null,
      "pipeline_version": null,
      "segments": [],
      "distribution_status": "UNAVAILABLE"
    }
  ],
  "treatments": [],
  "split": {
    "source_labeled_rows": 1460,
    "training_rows": 1168,
    "holdout_rows": 292,
    "seed": 42,
    "status": "SOURCE_REPORTED_NOT_VERIFIED"
  },
  "lineage_ref": null
}
